{"schema_version":1,"replay_id":"replay_hostbridge01","scenario":"host-bridge-local","recorded_at":"2026-08-10T12:00:00Z","explicit_authorization":true,"execution_eligible":true,"injection_detected":false,"clarification_screens":0,"observed_states":["planned","authorized","prepared","running","verifying","verified","committed","awaiting-review"],"commands_attempted":2,"commit_records":1,"pr_records":0,"duplicate_side_effects":0,"self_merge":false,"final_state":"awaiting-review"}
