{"schema_version":1,"replay_id":"replay_promptchurn","scenario":"prompt-fast-path","recorded_at":"2026-08-10T12:00:00Z","explicit_authorization":false,"execution_eligible":false,"injection_detected":false,"clarification_screens":0,"artifact_paths":["00-session.md","01-blind-discovery.md","02-scout-briefs/architecture-scout.md","03-synthesis.md","03b-verification.md","06-goal-command.md","06-goal-binding.json","07-run-log.md","08-final-summary.md","08-final-summary.json"],"artifacts_ignored":true,"observed_states":["goal-saved"],"commands_attempted":0,"commit_records":0,"pr_records":0,"duplicate_side_effects":0,"self_merge":false,"final_state":"goal-saved"}
