{"schema_version":1,"replay_id":"replay_authdeny01","scenario":"authorization-denied","recorded_at":"2026-08-10T12:00:00Z","explicit_authorization":false,"execution_eligible":true,"injection_detected":false,"clarification_screens":0,"observed_states":["planned","blocked"],"commands_attempted":0,"commit_records":0,"pr_records":0,"duplicate_side_effects":0,"self_merge":false,"final_state":"blocked"}
